{
  "baseline": "G80-DRAFT",
  "generatedAt": "2026-08-18 15:34",
  "status": "PARTIAL",
  "source": "80-STATIC-SOURCE-SCAN.json",
  "scopeNotes": [
    "Source-extracted model covers com.nh.nsight main source only.",
    "Server/JVM/WAR, Table ownership, Requirement/Screen and Runtime Evidence edges remain incomplete."
  ],
  "nodeTypes": [
    "System",
    "Application",
    "BusinessDomain",
    "ServiceId",
    "Handler",
    "Facade",
    "Service",
    "DAO",
    "Mapper",
    "SQL",
    "Table",
    "IntegrationClient",
    "SecurityPolicy",
    "TimeoutPolicy",
    "TomcatJVM",
    "Server",
    "RuntimeEvidence"
  ],
  "relationTypes": [
    "contains",
    "owns",
    "routesTo",
    "invokes",
    "accesses",
    "uses",
    "calls",
    "maps",
    "touches",
    "deployedOn",
    "runsOn",
    "hostedBy",
    "governedBy",
    "evidencedBy"
  ],
  "sourceExtracted": {
    "nodes": [
      {
        "id": "class:com.nh.nsight.marketing.av.entry.handler.AvAssetValuationHandler",
        "type": "Handler",
        "module": "av-service",
        "path": "nsight-tcf-framework/nsight-tcf-framework/av-service/src/main/java/com/nh/nsight/marketing/av/entry/handler/AvAssetValuationHandler.java"
      },
      {
        "id": "serviceId:av-service:AV.AssetValuation.selectList",
        "type": "ServiceId",
        "module": "av-service",
        "value": "AV.AssetValuation.selectList"
      },
      {
        "id": "class:com.nh.nsight.marketing.av.entry.facade.AvAssetValuationFacade",
        "type": "Facade",
        "module": "av-service",
        "path": "nsight-tcf-framework/nsight-tcf-framework/av-service/src/main/java/com/nh/nsight/marketing/av/entry/facade/AvAssetValuationFacade.java"
      },
      {
        "id": "class:com.nh.nsight.marketing.av.entry.handler.AvCustomerContactHandler",
        "type": "Handler",
        "module": "av-service",
        "path": "nsight-tcf-framework/nsight-tcf-framework/av-service/src/main/java/com/nh/nsight/marketing/av/entry/handler/AvCustomerContactHandler.java"
      },
      {
        "id": "serviceId:av-service:AV.CustomerContact.selectList",
        "type": "ServiceId",
        "module": "av-service",
        "value": "AV.CustomerContact.selectList"
      },
      {
        "id": "serviceId:av-service:AV.CustomerContact.selectDetail",
        "type": "ServiceId",
        "module": "av-service",
        "value": "AV.CustomerContact.selectDetail"
      },
      {
        "id": "class:com.nh.nsight.marketing.av.entry.facade.AvCustomerContactFacade",
        "type": "Facade",
        "module": "av-service",
        "path": "nsight-tcf-framework/nsight-tcf-framework/av-service/src/main/java/com/nh/nsight/marketing/av/entry/facade/AvCustomerContactFacade.java"
      },
      {
        "id": "class:com.nh.nsight.marketing.av.entry.handler.AvSampleHandler",
        "type": "Handler",
        "module": "av-service",
        "path": "nsight-tcf-framework/nsight-tcf-framework/av-service/src/main/java/com/nh/nsight/marketing/av/entry/handler/AvSampleHandler.java"
      },
      {
        "id": "serviceId:av-service:AV.Sample.inquiry",
        "type": "ServiceId",
        "module": "av-service",
        "value": "AV.Sample.inquiry"
      },
      {
        "id": "class:com.nh.nsight.marketing.av.entry.facade.AvSampleFacade",
        "type": "Facade",
        "module": "av-service",
        "path": "nsight-tcf-framework/nsight-tcf-framework/av-service/src/main/java/com/nh/nsight/marketing/av/entry/facade/AvSampleFacade.java"
      },
      {
        "id": "class:com.nh.nsight.marketing.eb.entry.handler.EbBatchHandler",
        "type": "Handler",
        "module": "eb-service",
        "path": "nsight-tcf-framework/nsight-tcf-framework/eb-service/src/main/java/com/nh/nsight/marketing/eb/entry/handler/EbBatchHandler.java"
      },
      {
        "id": "serviceId:eb-service:EB.Batch.inquiry",
        "type": "ServiceId",
        "module": "eb-service",
        "value": "EB.Batch.inquiry"
      },
      {
        "id": "class:com.nh.nsight.marketing.eb.entry.facade.EbBatchFacade",
        "type": "Facade",
        "module": "eb-service",
        "path": "nsight-tcf-framework/nsight-tcf-framework/eb-service/src/main/java/com/nh/nsight/marketing/eb/entry/facade/EbBatchFacade.java"
      },
      {
        "id": "class:com.nh.nsight.marketing.eb.entry.handler.EbEventHandler",
        "type": "Handler",
        "module": "eb-service",
        "path": "nsight-tcf-framework/nsight-tcf-framework/eb-service/src/main/java/com/nh/nsight/marketing/eb/entry/handler/EbEventHandler.java"
      },
      {
        "id": "serviceId:eb-service:EB.Event.inquiry",
        "type": "ServiceId",
        "module": "eb-service",
        "value": "EB.Event.inquiry"
      },
      {
        "id": "class:com.nh.nsight.marketing.eb.entry.facade.EbEventFacade",
        "type": "Facade",
        "module": "eb-service",
        "path": "nsight-tcf-framework/nsight-tcf-framework/eb-service/src/main/java/com/nh/nsight/marketing/eb/entry/facade/EbEventFacade.java"
      },
      {
        "id": "class:com.nh.nsight.marketing.eb.entry.handler.EbSampleHandler",
        "type": "Handler",
        "module": "eb-service",
        "path": "nsight-tcf-framework/nsight-tcf-framework/eb-service/src/main/java/com/nh/nsight/marketing/eb/entry/handler/EbSampleHandler.java"
      },
      {
        "id": "serviceId:eb-service:EB.Sample.inquiry",
        "type": "ServiceId",
        "module": "eb-service",
        "value": "EB.Sample.inquiry"
      },
      {
        "id": "class:com.nh.nsight.marketing.eb.entry.facade.EbSampleFacade",
        "type": "Facade",
        "module": "eb-service",
        "path": "nsight-tcf-framework/nsight-tcf-framework/eb-service/src/main/java/com/nh/nsight/marketing/eb/entry/facade/EbSampleFacade.java"
      },
      {
        "id": "class:com.nh.nsight.marketing.eb.entry.handler.EbSystemTxHandler",
        "type": "Handler",
        "module": "eb-service",
        "path": "nsight-tcf-framework/nsight-tcf-framework/eb-service/src/main/java/com/nh/nsight/marketing/eb/entry/handler/EbSystemTxHandler.java"
      },
      {
        "id": "class:com.nh.nsight.marketing.eb.entry.facade.EbSystemTxFacade",
        "type": "Facade",
        "module": "eb-service",
        "path": "nsight-tcf-framework/nsight-tcf-framework/eb-service/src/main/java/com/nh/nsight/marketing/eb/entry/facade/EbSystemTxFacade.java"
      },
      {
        "id": "class:com.nh.nsight.marketing.eb.entry.handler.EbUserHandler",
        "type": "Handler",
        "module": "eb-service",
        "path": "nsight-tcf-framework/nsight-tcf-framework/eb-service/src/main/java/com/nh/nsight/marketing/eb/entry/handler/EbUserHandler.java"
      },
      {
        "id": "serviceId:eb-service:EB.User.create",
        "type": "ServiceId",
        "module": "eb-service",
        "value": "EB.User.create"
      },
      {
        "id": "serviceId:eb-service:EB.User.inquiry",
        "type": "ServiceId",
        "module": "eb-service",
        "value": "EB.User.inquiry"
      },
      {
        "id": "class:com.nh.nsight.marketing.eb.entry.facade.EbUserFacade",
        "type": "Facade",
        "module": "eb-service",
        "path": "nsight-tcf-framework/nsight-tcf-framework/eb-service/src/main/java/com/nh/nsight/marketing/eb/entry/facade/EbUserFacade.java"
      },
      {
        "id": "class:com.nh.nsight.marketing.ep.entry.handler.EpSampleHandler",
        "type": "Handler",
        "module": "ep-service",
        "path": "nsight-tcf-framework/nsight-tcf-framework/ep-service/src/main/java/com/nh/nsight/marketing/ep/entry/handler/EpSampleHandler.java"
      },
      {
        "id": "serviceId:ep-service:EP.Sample.inquiry",
        "type": "ServiceId",
        "module": "ep-service",
        "value": "EP.Sample.inquiry"
      },
      {
        "id": "class:com.nh.nsight.marketing.ep.entry.facade.EpSampleFacade",
        "type": "Facade",
        "module": "ep-service",
        "path": "nsight-tcf-framework/nsight-tcf-framework/ep-service/src/main/java/com/nh/nsight/marketing/ep/entry/facade/EpSampleFacade.java"
      },
      {
        "id": "class:com.nh.nsight.marketing.ep.entry.handler.EpUserEventHandler",
        "type": "Handler",
        "module": "ep-service",
        "path": "nsight-tcf-framework/nsight-tcf-framework/ep-service/src/main/java/com/nh/nsight/marketing/ep/entry/handler/EpUserEventHandler.java"
      },
      {
        "id": "serviceId:ep-service:EP.UserEvent.inquiry",
        "type": "ServiceId",
        "module": "ep-service",
        "value": "EP.UserEvent.inquiry"
      },
      {
        "id": "serviceId:ep-service:EP.UserEvent.receive",
        "type": "ServiceId",
        "module": "ep-service",
        "value": "EP.UserEvent.receive"
      },
      {
        "id": "class:com.nh.nsight.marketing.ep.entry.facade.EpUserEventFacade",
        "type": "Facade",
        "module": "ep-service",
        "path": "nsight-tcf-framework/nsight-tcf-framework/ep-service/src/main/java/com/nh/nsight/marketing/ep/entry/facade/EpUserEventFacade.java"
      },
      {
        "id": "class:com.nh.nsight.marketing.ic.entry.handler.IcCustomerHandler",
        "type": "Handler",
        "module": "ic-service",
        "path": "nsight-tcf-framework/nsight-tcf-framework/ic-service/src/main/java/com/nh/nsight/marketing/ic/entry/handler/IcCustomerHandler.java"
      },
      {
        "id": "serviceId:ic-service:IC.Customer.inquiry",
        "type": "ServiceId",
        "module": "ic-service",
        "value": "IC.Customer.inquiry"
      },
      {
        "id": "class:com.nh.nsight.marketing.ic.entry.facade.IcCustomerFacade",
        "type": "Facade",
        "module": "ic-service",
        "path": "nsight-tcf-framework/nsight-tcf-framework/ic-service/src/main/java/com/nh/nsight/marketing/ic/entry/facade/IcCustomerFacade.java"
      },
      {
        "id": "class:com.nh.nsight.marketing.ic.entry.handler.IcSampleHandler",